title,selftext,Assignee,feas_pa,feas_ka,feas_cr,feas_sr
"Accepted a Job, Relocated, and Then Got My Offer Rescinded – Consulting Firm Nightmare","In other words, they filled the role internally, and my offer was rescinded. ""

Now I'm in a city I hadn't planned to move to, jobless, and scrambling to figure things out.  The worst part?  This wasn't some small startup—it was a major, established company. 

I know rescinded offers happen, but pulling this after someone has already relocated is beyond unprofessional.",Overlap,1.0,1.0,3.0,1.0
I Am a Fraud and ChatGPT Is My Brain,literally everything.  uni?  fake.  career path?  fake.,Overlap,4.0,4.0,4.0,1.0
Wow interviews suck more now,"This makes you look bad"" and I replied ""if you say so.  To me this looks like normal open communication "".  At that point the third person present ended the interview as it was obvious it wasn't going to work out

EDIT: just some details.  The recruiter mentioned the salary and asked me if i agreed before i was interviewed.  I said yes.",Overlap,1.0,1.0,1.0,2.0
Think I'm about to turn Netflix down. Am I crazy?,"Did all 7 interviews down and got an offer.  50% rise on my basic and the ability to take as much or as little as stock. 

I asked for the weekend to think about it.  Had pretty much decided I would take it.  Then come Monday and my wife finds out she's pregnant.",Overlap,1.0,1.0,1.0,1.0
"The bar is absolutely, insanely high.","Interviewed at a unicorn tech company for internship, and made it to the final round.  I felt I did incredibly well in the OA, behavioral, and technical interview rounds.  For my final technical round, I was asked an OOP question, and I finished the implementation within 40-45 minutes.  The process was a treadmill style problem, so once I got done with the implementation, I was asked a few follow up questions and was asked to implement the functionalities. 

I felt that I communicated my thought process well and asked plenty of clarifying questions.",Overlap,1.0,1.0,1.0,1.0
Job offered and then rescinded after i accepted.,"Immediately, they responded saying the offer was a mistake.  I was so heartbroken :( 

Then a couple hours later, a partner at the firm connected with me on linkedin, which felt like they were TORTURING me.  I messaged him thanking him for connecting and stating that I'm disappointed I won't be joining them this summer.  He responded saying that they told him they were hiring me.  Not sure what to even think at this point because clearly they agreed as a company to hire me and then rescinded it within half an hour?",Overlap,1.0,1.0,1.0,2.0
Wow y'all were right... (Referrals),"I tried reaching out to recruiters, but I barely got a response this late in the cycle.  Anyway I happen to stumble on one of my childhood friends linkdin page and see that he got a recommendation from the chief officer of the company he intered at the summer before so I hit him up and ask him about it.  He encourages me to send him an email.  So I find his company email and send him a connect request pretty much stating that I was a good friend of the person he gave the recommendation to and asking if their company was still accepting interns attaching my resume and if we could schedule a time to call.  Within 2 days he replies saying that ""any friend of (friends-name) is a friend of mine"", that I had a solid mix of skills on my resume, and that he was going to check if there are any project/internship openings for me to do.",Overlap,1.0,1.0,1.0,1.0
"After 8 hours of interviews, they're offering me less than minimum salaried wage for my state. Where to go from here?","Clearly not.  

I did 8 interviews, a presentation, a written interview, and an IQ test.  Two VPs grilled me.  This is a graduate level role. 5 years experience.",Overlap,2.0,1.0,1.0,1.0
THIS is why you don't get any responses from your job applications...,"**anybody** who can get our resume past the recruiters and onto the hiring manager's desk.   

**621** applicants in one week?  **88** per day?  for a Receptionist gig with **ZERO flexibility**?  And probably low pay?",Overlap,1.0,1.0,2.0,1.0
I've about reached my limit,After going through a 20 minute personality test I get hit with this this for a PR job.  I'm so tired of this.  The endless games and humiliation rituals.  The AI recruiter chat popups.  The passive aggressive interviews.,Overlap,1.0,1.0,1.0,2.0
What can I pivot to from Software Engineering,"I'm doing LC for 4 hours per day starting at 5am and reviewing the problems at night.  It between I apply for jobs and study system design, practice the other programming languages I know.  

I can obviously code and love to.  I think I'm a hard worker but I don't think that's enough for this field that I spent years studying in undergrad and grad for.  What other fields can I look into?",Overlap,4.0,3.0,1.0,1.0
It's Alarming How Many People Have No Clue What's Going On in the Job Market,"I find it genuinely hilarious when recruiters and hiring managers act confused about gaps on a resume.  I once had a recruiter ask if the gap on my resume was spent job hunting, and then questioned why it took so long.  There seems to be this widespread belief that people leave jobs willy-nilly just to go backpacking through Europe or to sit around doing nothing.  Realistically, we can barely afford basic living *WITH* a job so what makes anyone think we can afford to quit and take on even more expensive adventures? ""

Comments like these almost always come from people who are completely out of touch with the current job landscape.",Overlap,2.0,1.0,1.0,1.0
"6 months job hunting, apparently my 4+ years don't count because I haven't touched their specific tech stacks","How am I supposed to get experience if no one will hire me to get experience? 

I know some of you have been in similar situations.  How did you break through this stupid cycle?  I'm starting to think I should just lie on my resume about having used every vendor's gear and hope they don't quiz me on CLI commands during the interview.",Overlap,4.0,1.0,1.0,1.0
10 Totally Legit Reasons Why Getting a Job in 2025 Is the EASIEST Thing Ever.,"Or, maybe you're not following up with a thank you haiku after interviews.  Honestly, do you even want it? 

Good luck out there, future CEOs.  See you in the trenches!",Overlap,1.0,1.0,3.0,1.0
Wow!! Rejected 2mins into the interview,"So a bit of context, I am an international student who requires SPONSORSHIP, and I applied for a job last week.  I got an assessment, which I cleared, and then got a follow up interview setup with the CTO of the company.  

It began with a casual Hi and hello, and how do you pronounce your name, where are you from etc.  etc. "".",Overlap,1.0,1.0,1.0,1.0
Stop treating interviews like dating. This isn't a social club. It's someone's livelihood.,"Maybe railing against cultural fit wasn't the right word for it.  But maybe give people grace, if they seem nervous.  Give people grace if they say one stupid thing, maybe consider the fact that they're nervous that their whole life is on the line.  And maybe look past them saying one stupid thing. 

3 of these 7 times have been because they chose someone else and I get it, it sucks.",Overlap,1.0,1.0,3.0,1.0
Stop treating interviews like dating. This isn't a social club. It's someone's livelihood.,"It is probably my nerves causing me to not make it that far more often but when I do I always have to remember to not get too excited about a possible yes because I have been here soo many times before and gotten told no soo many times. 

I just want one yes. ***

Tired of hearing ""culture fit"" as a rejection reason when the candidate could clearly do the job.  Tired of interviews being treated like a vibe check instead of a skills assessment.  Tired of people being rejected because they don't act exactly like the rest of the team, even though diversity of thought is what companies claim to value.",Overlap,1.0,1.0,3.0,5.0
Recruiter asked me to lie about competing offer,I got a very low ball first offer and was about to negotiate it.   All I did was reply to the offer with a counter offer and a list of reasons why I deserved it.  Happy Ending!,Overlap,1.0,1.0,1.0,1.0
I did it.,"My foot is officially in the door. 

All this to say, it's hard.  It took a long time.  I didn't have an internship or good GPA, but I did it.  You can too.",Overlap,2.0,1.0,1.0,1.0
How much harder is it for ppl to get a ft job in tech without interning in that company first,"Cuz if im a HR, I would feel that even a 10 round interview would not be as gd as an previous internship at the company in helping me see the compatibility of the candidate.  

Or is the fact that im from CDE the biggest disadvantage I have

Any opinions or advices are welcomed!  Thanks in advance.  

Edit: not sure im being clear enough, but basically im trying to ask if most people get their first job with a return offer or is directly applying and getting the role also common.  Do companies prioritise previous interns WAY more than a someone that isnt a previous intern but have a seemingly promising resume.",Overlap,1.0,2.0,3.0,1.0
[Rant] Rejected in 15 minutes by CEO after 4 rounds and days of work,"Added other features also.  Discussed it in-depth with the CTO (1-hour technical discussion). 
4.  **Follow-up Round** –  1-hour technical with the CTO.  For this round, he asked me to implement OpenAI API for text analysis of reviews and auto-suggestions based on customer feedback.",Overlap,1.0,1.0,1.0,1.0
I quit CS and I'm 300% happier.,"I slaved 2 years in a IT dev program.  3 internships, hired full time as dev (then canned for being too junior), personal projects with real users, networking 2x per month at meetups, building a personal brand.  Interviewing at some companies 5x times and getting rejected for another guy, 100's of rejections, tons of ghost jobs and interviews with BS companies, interned for free at startups to get experience 75% which are bankrupt now, sent my personal information out to companies who probably just harvested my data now I get a ton of spam calls.  Forced to grind Leetcode for interviews, and when I ask the senior if he had to do this he said "" nah I never had to grind Leetcode to start in 2010. 

Then one day I put together a soft skill resume with my content/sales/communications skills and got 5 interviews in the first week.",Overlap,2.0,4.0,3.0,1.0
I uncovered a scam trying to hire for a remote engineer position,I investigated and actually spoke to one of them.  It was a scam.,Overlap,1.0,1.0,1.0,1.0
Was I delusional to ask for $130k? New grad offer in Chicago is $62k.,"A friend of mine told me something similar, too. ) shows new grad tech roles in the $110k-$150k range.  Now I'm completely confused.  Was I living in an illusion thinking that number was achievable?  Or is $62k a major lowball, even for a new startup in Chicago?",Overlap,1.0,1.0,1.0,1.0
What the smartest Career-Pivot in today's economy?,"Ive always cared about being able to make a lot of money.  The last thing I want to do is pour my heart and soul into a career that doesnt provide for my family.  I dont mind high stress.  Don't mind long hours.  

Anyways, im kind of at a crossroads, where I feel like im young, i can still switch to almost any career and probably make a decent living out of it.",Overlap,1.0,1.0,1.0,1.0
Is tech job market really cooked ?,"Got about 15 interviews, 4 offers.  I think I could get more offers tbh but after I found the company I really liked I accepted an offer and stopped the interview process with the rest.  I interviewed with Capital One, Visa, UKG, Amazon, Circle, Apollo, Citadel, FICO, GM and some no names or startups.  That's all to say that after reading reddit I was anxious to even apply but I think I got a decent amount of interviews and negotiated my offers to be either at the higher end of the salary range for the role or even above advertised.  I do recognize it's much harder for junior engineers these days but is there really a shortage for experienced engineers?",Overlap,1.0,1.0,2.0,1.0
My mom keeps using AI to create false resumes what should we do?,"For background; when I was unemployed with no experience, my mom used ChatGPT to modify my resume and then she applied me for jobs without telling me.  She even got me an interview. 

Then I saw the resume she used was full of lies: a fake internship at my alma mater, made-up roles, the works. ""*

I refused to take the interview and withdrew my application.  She was furious.",Overlap,5.0,1.0,1.0,1.0
Name and Shame: ePlanSoft,"The fact that this was not internally discussed prior to me going through the whole process is extremely inconsiderate of my and other candidates' time. 

Extremely frustrating, but hey, maybe I dodged a bullet.  If they are this disorganized during interviewing, it would probably be a nightmare to work for.  They are also going through a re-org, after being acquired by private equity a few weeks ago. 

It sucked getting the call - especially after talking to 10 people about the role - but my interview skills now are sharper.",Overlap,1.0,1.0,1.0,1.0
How are job prospects for international students?,"I will be applying to NUS and NTU for MSc DSML, and i was wondering about how are the current job situations in the AI/ML front for intl students(i already know the blood bath that is SWE). 

Something about myself, I have very good projects + 1-2 publications, and 2 research internships in t 20 universities.  LORs i have are moderately strong but will work on my remaining lacking aspects during my mastera.",Overlap,2.0,1.0,2.0,1.0
How do you guys decide what you want to do late into your uni life?,"Hi all, I'm a Engineering student graduating next year, I'm just started an AI (LLM) development internship with one of the Gov R&D organizations, but have also been interviewing for some organizations that were open to non-CS related majors to try out cybersecurity traineeships.  You can say that my portfolio is more geared towards AI with my coursework containing robotics, machine learning and LLMs, but I was keeping my options open, so tried interviewing for other kinds of roles as well.  Somehow managed to pass the technical assessments.  Low key stressing out right now with the interview invites, which I genuinely did not expect.  I am wondering if fellow job-seekers could chime in on some perspectives for a person without a CS background; what should I prioritize?",Overlap,3.0,2.0,1.0,1.0
To accept full time offer or wait it out?,"as the title states, should i accept full time offer or wait out for the possibility of a better opportunity?  

disclaimer: i just want to say that i am grateful to get a full time offer amid this current market and this post is by no means ""humble bragging"" whatsoever.  i am just genuinely curious what readers might do in my situation because i am unsure of what to do 

for context, i was recently offered a position in a company.  i am quite neutral about the industry, role, and in fact, i think the company is slightly toxic in terms of culture, with strong OTs and turnover rates.  they want me to start in jan/feb next year.",Overlap,1.0,1.0,2.0,2.0
What do companies honestly think of the NTU resume template?,"Ended y4s1 jn, and alr starting to look for graduate jobs.  While I was working on updating my resume and linkedin profile, smth came to my mind.  the current resume template im using is the one u get from Vmock when u do ML0004. 

At all the previous job-in fairs and career fairs I have been to, ppl were carrying around and handing out resumes with the exact same templates.  There was even a time i rmb overheard a lady at the Dyson booth (presumably HR) asking her colleagues abt why all resumes look the exact same.",Overlap,1.0,1.0,4.0,1.0
"After being turned down for $14 jobs, I finally got a good job offer and I can't stop crying.","2.  Second interview $14.  The interview was fully in Spanish.  I did bad because even though I do speak Spanish, I don't speak it professionally and spoke in Spanglish.  

3.",Overlap,4.0,1.0,1.0,1.0
"Whatever happened to ""learn on the job""","Why does every entry level job, internship, Co-op require experience in CI/CD, AWS, Azure, Docker, Kubernetes, Jenkins, Kibana, Grafana, Data lakes, all JavaScript frameworks, Pytorch, N8N? 

Why doesn't any company want to hire freshers and train them on the job?  All these technologies are tools and not fundamental computer/math concepts and can be learned in a few days to weeks.  Sure years of experience in them is valuable for a senior DevOps position, but why expect a lot from junior level programmers? 

The same senior engineers who post these requirements were once hired 10-15 years ago as a graduate when all they could do was code in Java, no fancy frameworks and answer few questions on CS fundamentals.",Overlap,4.0,1.0,2.0,1.0
Why does every career path seem hopelessly competitive?,"Impossible to break into unless you're a 1 in a million genius.  Sales?  I suck with people and there's no way I'm ever getting better.  I just want a good job so that I can retire someday and live a comfortable life taking vacations and enjoying stuff.  Instead I'm stuck working warehouse for the rest of my life and getting mocked by everyone for it, my roommate (who is a lawyer) calls me ""factory girl"".",Overlap,5.0,1.0,1.0,1.0
fresh grad job experience + opinion,"hi!  would appreciate any advice or experiences from seniors regarding ur opinions on fresh grads' first FT jobs!  

i've been constantly thinking about the company that i work for, for my first FT job — do you guys prefer govt-related jobs, MNCs or start-ups etc?  

the general consensus is that govt jobs are stable & secure, while MNCs have a larger chance of promotion & pay increment.  start-ups on the other hand may give u more exposure on handling multiple aspects of a biz, which may be stressful but it in turns forces u to ""grow"" faster.",Overlap,1.0,1.0,1.0,1.0
CCDS Policies will NOT help your job search,"Final thing to CCDS : The difference in GE will show more clearly in the upcoming years

To students that are suffering under this shitty policy: Ive done about 30+ technical interviews in sem 1 alone(big tech, quant, etc), and no one now cares about your GPA.  You can choose to believe me  or not, its up to you.",Overlap,1.0,2.0,1.0,1.0
Can you resort to just emailing small local businesses for opportunities?,"There are several web design and development businesses in my area.  They are all teams in the range of 20 - 50 members, with only around 2-5 developers.  None of them have employment opportunities posted.  Would it be reasonable to email them, or fill out their contact form to see if they have an internship opportunity available?  I would not really want to work for free, but would be willing to do lower wage work out of desperation and inexperience.",Overlap,5.0,1.0,1.0,1.0
Found this to be the most reliable way to still land jobs,"The markets become extremely competitive, a ton of new grads and layoffs flooding the industry with experienced folk so being strategic is more important than ever before. 

A couple of things that worked for me:

\- Build connections with recruiters, even if you don't get hired send profiles of your friends over to them, help them fill roles. 

\- Build in public, share your project wins on LinkedIn, Reddit, X, YouTube, etc.  The more visible you are the easier it is for companies to find you. 

\- Need to leverage the tools available to you.",Overlap,1.0,1.0,3.0,1.0
We need to talk about the Gen Z job crisis.,"The search results for ""job market 2026"" and ""Gen z job crisis"" compelled me to write this. 

I see articles everywhere describing how bad the new grad job market is and how we're having to compete with millions of experienced laid off workers for entry level jobs.  Over 70% of new grads are underemployed according to multiple sources online. 

I posted here a couple weeks ago, recounting my experience and frustration in the job market in the United States as a somewhat distinguished American new grad in STEM. "" It gained a large amount of traffic and discussion in about 12 hours, but honestly it affected me emotionally too much so I decided to delete it.",Overlap,1.0,1.0,3.0,1.0
Switch tracks to Information Systems to avoid Math? (DevOps/backend engineer),"So I already know how to develop massive backend projects and run servers.  I have been doing so since middle school.  I'm very interested in backend engineering/devops roles.  I'm really just going to college for the paper, I already have skills.  I'd also ideally like to stay in the midwest (Michigan) for jobs.",Overlap,1.0,4.0,1.0,1.0
How can I improve my chances of being hired?,"Its real bad. 

2 years of time off, therapy, and a gender transition later, I'm back in school and making all As.  However, I'm worried I'm in too deep at this point.  I like doing this, this is what I want to do, but I'm worried my bad GPA, history of failure, and lack of school prestige is going to just sink me entirely for both internships and full time jobs once I graduate

Does anyone have any advice for what I can do to improve my chances?",Overlap,5.0,1.0,1.0,1.0
"New grad with no work experience, should I pivot?","My interest is in data analytics, but I have experience with MERN as well.  I graduated May 2025 and enrolled into a masters spring start date to hide my employment gap as I continue to build projects in my coursework/campus orgs and network within my field. e.  GRA) because I have no experience and the same chicken-egg scenario occurs with campus recruiters for internships.  I am also reaching out to startups.",Overlap,4.0,1.0,1.0,1.0
I GOT AN INTERNSHIP AFTER TWO YEARS!! this is what worked for me,"Last summer I was unemployed and depressed.  I felt like a dissapointment to my parents, especially seeing my friends progress with their lives while i was back at home bedrotting everyday.  I told myself that i NEEDED to lock in and get an internship for this summer, orelse I had to apply for some retail job like starbucks to keep me afloat. 

Welp… this morning after 624 job applications, I finally got my offer letter today.  It's not a big prestigious company like amazon but im literally so happy and cannot complain.",Overlap,5.0,1.0,1.0,1.0
"CS graduated who abandoned his career,  is there a light at the end of the tunnel for him?","Although I have no experience in cloud, do you think it is a wise suggestion?  I have started prepping for AZ900 (which I know, doesnt help in securing a job as its just fundamentals but its a necessary step to cloud).  Its been so long since I coded that I have forgotten almost everything about it. 

Or should I look into AI and Data Science stuff?  Feels complicated but since there is all the hype about it and how AI is the future, I am not sure.",Overlap,5.0,1.0,1.0,1.0
Software engineering major but unsure about SWE careers,"Roles that don't require grad school? 

If anyone's been in a similar spot or pivoted away from traditional SWE roles, I'd really appreciate hearing what you moved into, what skills actually mattered, and how you broke in.  Thank you so much!",Overlap,2.0,2.0,1.0,1.0
WGU CS Grad to OMSCS: Where are you now?,"I'm making this post specifically for WGU CS grads that decided to enroll into OMSCS.  What was your experience like getting internships and job offers?  Did you still need to apply to hundreds of places even with OMSCS on your resume? 

I graduated from WGU back in 2024 and I also got my AA in CS.  I was accepted into OMSCS last year but I withdrew because I thought if I just applied like crazy I'd be able to get a job.",Overlap,1.0,1.0,1.0,1.0
New Grad Preparation Advice Needed,"My current plan:  
\- Start applying in July  
\- Practice DSA problems, leetcode, and systems design like I have been the past month  
\- Frame my experiences on my resume a little differently than how they are now (I feel like my bullets are weak and some things may be irrelevant, it might be worth more for me if I list different things)

Some questions:  
\- With my current internship experiences, is FAANG or any other T100 company that provides traditional SWE jobs an unrealistic goal for me?   
\- Will people not look at me seriously because I interned at the same company 3 times? )  
\- Am I doomed to be locked out of a traditional SWE job no matter how hard I try? 

Thank you, and apologies for the doomer-ism in this post.  I'm just worried about my future.",Overlap,4.0,1.0,1.0,1.0
I am wasting my talent because I don't know what to do with it,"I am panicking about my future because opportunities seem so tight these days, and I think it is unfair.  Here is my story. 

  
I am a 23-year-old software developer from a third world country. 9/4) in 2024.  I interned at two machine learning software companies before I graduated.",Overlap,1.0,1.0,3.0,1.0
Seeking Guidance,"I enjoy game design and have been looking for any kind of similar role like QA, but it seems like they all require ""5 years experience"" for an entry level position. 

2: I am 100% over reliant on AI for any sort of programming or debugging.  It has gotten so bad that I am starting to forget syntax since i'm so used to either autocompleting or throwing my entire file into gpt or claude and copy and pasting the result without checking.  Not to deflect the blame from myself but this has become a huge problem at my school and way too normalized.  It's basically a collective addiction/necessity for students and professors now too.",Overlap,5.0,4.0,1.0,1.0
