title,selftext,Assignee,feas_pa,feas_ka,feas_cr,feas_sr
"CS graduate, AWS + K8s certified, multiple final rounds, still no offer. What am I doing wrong?","I still want to work in cloud or DevOps.  But I'm exhausted and confused. 

What hurts the most is seeing people I personally know, with weaker profiles, landing roles or making money freelancing.  I know comparison is unhealthy, but it's hard not to feel like I'm doing something fundamentally wrong. 

At this point I'm wondering
What would you do in my position?",3,4.0,1.0,5.0,1.0
CS New Grad Career Pivot From SWE to Data Analyst,"And I understand a CS degree isn't the same as SWE but what am I supposed to do now?  

Fast forward two months after graduating and I have no impressive projects or career experience.  I tried to teach myself React and Javascript since we were never exposed to that in school and I'm so lost.  I keep hearing BUILD, BUILD, BUILD but I don't even know where to begin.  All of my theoretical knowledge of SWE is just a soup of classes, data structures, and OOP but I can't apply it.",3,4.0,5.0,3.0,1.0
6 Months of unemployment... Here's my experience,"Turns out I'm not... 

I'd get response emails from recruiters saying 'We've already filled this vacancy' or immediate rejections 2 minutes after applying.  Or invites to interviews in which I got told 'We're looking for a male candidate at this time' or 'we're prioritizing internal candidates' or even 'We know you like healthcare more than you'd like working for us, so we won't hire you'.  I never applied for anything outside of my capability, or with qualifications that I don't have.  I just had no luck, and 90% of the time I couldn't even get in the door for an interview because they've already filled the position.",3,1.0,1.0,5.0,1.0
Ranking Bay Area companies by my recent interview experience,"* The recruiter only reached out to me by email and only to ask for my availability for ""the next step"".  They never elaborated what the next step would be or how long it would take.  I walked into the first tech screen thinking it's a recruiter call.  The second time they asked for my availability, I had to send 3 emails just to clarify whether it's another call, how long it is, and what is the focus. 
* Two weeks after the first screen, the recruiter still claimed that they had not received feedback from the interviewer.",3,1.0,1.0,1.0,1.0
I finally got a JOB!,"Then out of nowhere in January they set me up for another 2 interviews with other members of the team, and asked me to do a case study.  It has been 3 weeks after the case study and they just never even got back to me. 

  
This post is just for me to share how relieved I am.  The current job market really sucks, and getting hired at this stage feels like more luck than anything else.  Best of luck for everyone out there searching!",3,1.0,1.0,1.0,1.0
"Is grinding DSA problems still worth it in 2026, or has the hiring meta actually shifted?","I've been prepping for FAANG-style interviews for 3 months - blind 75, NeetCode, the whole thing.  But I'm noticing a lot of recent interview reports mention more system design, behavioral rounds, and even take-home projects replacing LC hard problems.  At the same time, Google and Meta still seem to do full LC gauntlets

For people who've interviewed in the last 6 months: what did you actually encounter?  Is LC still the meta at top companies, or is the landscape genuinely changing?  And for mid-size / non-FAANG - was LC even relevant?",3,1.0,1.0,1.0,1.0
Help with getting an entry level job,"I have even tried tailoring to the job posting, but no luck there either.  So I am not sure what I am doing wrong. 

I am in the USA as an international student if that helps with additional context.",3,1.0,1.0,1.0,1.0
This company did something worse to me than ghosting- keep me hanging,Another month went by without any updates so I reached out again and they finally said that they've decided to pursue someone else.  Now I understand that I might be a backup or it was a compliance job listing to hire an internal candidate but not sure why they'd verbally offer the job if that was the case.  And these guys didn't have the professionalism and courtesy to let me know that they've moved on after keeping me waiting for almost 3 months.  I checked their Glassdoor (should've done before tbh) and it's filled with similar experiences.  Seems like they have a habit of telling people they'd offer them the job only to ghost them later lol.,3,1.0,1.0,5.0,1.0
My SpaceX Interview Experience,"I accepted and did the phone screen and was told by my recruiter that the feedback was positive from that screen as well and that I should be expecting an offer soon. 

A few days later I was contacted by my recruiter saying that despite the process they had put me through, they would not be offering me the position. "" This was pretty devastating news to hear given that I'd received nothing but positive feedback.  I also thought this as a pretty poor showing on the part of SpaceX as they should not be recruiting for a position that they do not have the funding for. 

My recruiter then said he did have a few other positions available that he was recruiting for if I was interested.",3,1.0,1.0,5.0,1.0
"Second Round Interview (Won't Disclose Salary Because it is ""Internal"" to the structure of the business)","Bizarre.  The company looks good.  The staff seem pleasant.  The actual work is interesting, but in the Second Round (and last) Interview, they still would not reveal the salary of the role because of the internal structure of the company (Committee/Council style government that votes on the salary of staff). 

Like, there are no - other - red flags in the job itself, but this just seems needlessly obtuse.",3,1.0,1.0,1.0,1.0
Should I lie on my resume/application?,"I've put in time,  I have gone above and beyond my duties, and I have multiple people in my department willing to vouch for me (one of whom is a CFE).  I've been trying to apply to internal roles in Fraud and/or AML.  The roles require 1+ years of direct experience.  I thought since I'm a well established internal candidate, already pursuing credentials at my own cost, I *might* stand a chance.  Nope.",3,1.0,1.0,2.0,1.0
My Recent Interview Experiences in 2026 Hiring Market,"Well, meet interviewer **number one**.  the interviewer seemed completely uninterested.  I assumed workload distraction. "".  Next day, ""we have decided to move in another direction at this time"".",3,1.0,1.0,1.0,1.0
My Recent Interview Experiences in 2026 Hiring Market,"One interviewer asked me a question completely unrelated to the tech stack (from the job description).  I still answered it well.  Then I asked him something just a casual discussion point and he had no idea what I was talking about. 

So yeah.  There are interviewers out there who know less than the candidates they're judging.",3,1.0,1.0,1.0,1.0
Nightmare interview with finance bros,"I really wanted to just leave Zoom about halfway through.  I was in no way prepared for the kind of interview they gave absolutely no warning for.  I was so stressed after the interview that I had a nightmare about this hahaha..  But by today afternoon, I kind of felt sorry for them.  The fact that they had to do the interview at 10pm meant that they were nowhere close to going home and their jobs seemed to be their entire personality.",3,1.0,1.0,1.0,1.0
war is over. i can't believe it. (+ tips),"my confidence and articulation of common answers has skyrocketed from july 2025 to now.  i started believing in myself again. 

7.  crying feels awful, it will feel worse if you don't. 

8.",3,1.0,1.0,1.0,1.0
Washed up IT graduate with no chance at getting anywhere,"Unless I have a cool web project with a clean UI and good code, that I can show people to show my value to the team, then *maybe* I stand a chance but other than that, there's no point.  

I really feel like this is the end.  I can't keep doing this job search anymore.  I might just fall off the end of the earth, it's way better than the rejection emails I get or getting roped into another alternative where they offer paid services.  I'm can't do this.",3,5.0,5.0,5.0,1.0
How do I answer why did you quit your job and still get the job?,"Next week I have a job interview.  The company I am interviewing for knows of an internship I recently held and quit.  In my industry, it will be likely I am asked how's it going.  If asked why I quit I need advice on how to respond. 

For context, I am about to graduate college and just quit an internship I had.",3,1.0,1.0,1.0,1.0
Employment scams posted online - ps be aware.,"So that's it wrote to them and said how I think it is them and ask them to stop.  They again denied everything as you might think. 

Now within a week another mail came in which i totally ignored it - same modus and everything else similar just a different company - This last one after confronting them was just sent out as a decoy trying to say ""well its not us after all you confronted us and we came clean"". 

Generally this IT and consulting industry is over run by small Indian companies and is rife with fraud - resume embellishment, visa papers misrepresentation to client and educational credentials misrepresentations. 

Now I am hoping to hear others come out and speak about their own misadventures and has any one run into these people at Intellibus or the people whose names i have mentioned.",3,1.0,1.0,1.0,1.0
Finally got a JOB!,"It has been TWO years, TWO whole years since I have been applying.  This is the absolute worst job market I have ever seen in my entire life since the 80's.  I have sent thousands (no exaggeration) of applications and I have landed only \*6\* companies who responded with interviews. "" One place made me interview seven times, and gave me an onsite tour and practically almost a verbal offer but then ghosted.  Later found out that job was dissolved and I suppose they were just embarrassed?",3,1.0,1.0,3.0,1.0
"Had an interviewer cut me off because I was ""not qualified"" ‚òπÔ∏è","For Context: I am an Accounting student who applied to a job as an AI Accounting Analyst.  

I felt very prepared and qualified, as almost all the requirements expected, plus some additional ones.  

I passed the screening interview, and was sent to the second and final interview a week later.  From the screening, I felt that this job was a effect fit. 

After starting the interview, I was given an explanation of the company as well as their product.",3,1.0,1.0,1.0,1.0
"CEO said ""end of week"" for hiring decision - it's 2pm Friday and nothing. Am I cooked?","EDIT: I got the job!!!  


Had my second interview Monday with the CEO of a company for a Jr.  Sales Rep role.  Interview went really well and he said he'd let me know by end of week. 

It's 2pm Friday and nothing yet.",3,1.0,1.0,1.0,1.0
Are neurodivergent candidates with other conditions like me just screwed in this job market?,"I guess when a job requires a graduate education too, they expect that teaching experience to be transferable to employee training.  Given that I didn't do well at teaching and my limitations that I mentioned earlier, that's not going to work out for me at all.  Vocational rehabilitation in a meeting this past December did tell me that one of their employer partners said I was overqualified for a Clinical Research Assistant position I applied to back in November too.  I was furious to hear that news even though it was real. 

Then, there's the disability piece too.",3,1.0,1.0,4.0,3.0
Interviewer didn't showed up,"Nothing.  Total ghost town. 

After I logged off, I went back to re-read the original confirmation email they sent me.  I noticed something I missed before: Under ""Sourcing Contact"" and ""Phone Number,"" the fields were literally \\\[BLANK\\\]. 

It looks like they just sent me a raw template without actually assigning a recruiter or syncing it to an interviewer's calendar.",3,1.0,1.0,1.0,1.0
Need advice,"I feel like I am just waiting for a shit ton of stress here. 

Now I am actively searching for new job places..  but in general, how fcked am i?",3,1.0,1.0,1.0,1.0
Should I follow my dream or choose stability?,"However, I feel like this is a classic dilemma between following my dreams and choosing stability.  I'm a little scared about career suicide, especially being so fresh out of college.  But at the same time, I'm young, and I feel like if I'm going to pivot, I should just do it sooner rather than later.  However, the economic aspect weighs on me.  I would appreciate any advice, comments, or even anything similar that you'd like to share.",3,2.0,2.0,1.0,1.0
"Got fired yesterday, third interview tomorrow","Last week employer said I could show my best in SEO skills to write text for the website but this week they fired me unexpectedly.  

The feedback I got is very much not in line with feedback I had with multiple internships nor my whole past life.  I was ready to be a jr marketeer. 

Tomorrow on wednesday I have my third very promising interview with a company.  I told them my current employer doensnt know Im looking for another job.",4,1.0,1.0,1.0,1.0
I Am a Fraud and ChatGPT Is My Brain,"i'm just a human-shaped vessel with zero skills, zero original thoughts, and a complete dependency on a chatbot to function. 

i'm so socially inept it's laughable.  every time i have to talk to someone face to face i literally want to melt into the floor.  interviews?  kill me.",4,5.0,1.0,4.0,5.0
"The bar is absolutely, insanely high.","It's a competition, but I can't hate the players.  I can just choose not to play. 

I am still a bit bummed out that I didn't get the job offer, but how do you handle rejections like these?",4,4.0,1.0,2.0,1.0
Self-sourcing jobs or internships as a UG/Graduate,"Also, do people actually DM hiring managers on LinkedIn here or is that not really a thing?",4,1.0,1.0,1.0,1.0
Science UPIP,"The science UPIP department became a lot stricter in recent AYs when it comes to rescinding of internship offers. 

For context, I am from either Stats/Math/DSA.  This is my first time getting offers (first internship), so I immediately applied under UPIP for the first offer I received from company A.  Low and behold the day after, I received another offer from company B.  I didn't expect this since the interviewer gave me black face throughout, which made me lose all hope of securing this intern.",4,3.0,1.0,1.0,1.0
"After 8 hours of interviews, they're offering me less than minimum salaried wage for my state. Where to go from here?","I'm based in and will work in California.  The company is headquartered in the UK.  This is a graduate level customer success manager role at an international tech company.  

The salary was not posted on the job listing AND I asked the HR person I interviewed with what the allocated salary was for the role and she said she ""didn't know"" but was very comfortable asking me detailed questions about what I made in my current role.  I told her and thought we were on the same page.",4,1.0,1.0,1.0,1.0
No internship offers am I cooked?,"What other roles should I try to apply for? 

Question: If I don't get an internship for this semester (PI), I probably won't get to attend convocation if I clear my PI in my last semester, correct?  Any stories of people managing to attend convocation even though they are attending an internship in their last semester? 

Edit\* I got an offer, so dreams do come true!  I wish the best for any other student out there still applying and stressed out for internship applications.",4,1.0,1.0,1.0,1.0
SpaceX flew me out to Florida then cancelled the 3 positions I interviewed for,"I literally interviewed with 3 teams on site in Cape Canaveral and knocked all interviews out the park and got amazing feedback from my recruiter

I literally spent \~30 hours preparing, pulled an all nighter, and they flew me out from Boston only to be told that the team didn't get approval from the VP to hire. 

This bullshit happened last month

The interview process consisted of:  
\- 3 30-minute phone screens (before flying out)  
\- 1  45min long written exam (onsite)  
\- 1 60-min long technical presentation about my work (panel of 8 people)  
\- 6 1-on-1 interviews

THAT'S ELEVEN ROUNDS..... 

EDIT 3: Since I got many DMs, the company I'm building is called Radar.  It's an AI agent that automates your job search 

EDIT 2: To clarify, I was scheduled to talk to the VP as a final round but then that got cancelled because they never got approval to hire in the first place.   
Also, their on-site is structured so that if you're not doing well in the interviews (or if they're not impressed early on), they'll cut the day short and send you home.",4,1.0,1.0,1.0,1.0
I'm so tired of this.,"Stepfather's company finally opened another entry level IT tech position, something I pivoted towards getting certs and a degree.  He spent days gathering information from their HR department.  And after hours of tweaking my resume, cover letter and filling out their awful PDF application… I get a measly email telling me the exact opposite of what they discussed with him.  

Once again, dangling that carrot when you clearly had an internal candidate already picked out.",4,1.0,1.0,1.0,1.0
"Job Search After 4,000 Applications","At first, all of the positions I was applying to were full time jobs.  Then in January, I switched to applying to internships mostly, as they did not require previous experience.  My interview rate definitely went up after that.  I received my offer letter in the middle of April.  There was only exactly 1 week between the first interview and signing the offer letter.",4,1.0,1.0,1.0,1.0
"IKEA: ""No AI cover letters, please!"" Also IKEA: uses AI to filter your resume faster than you can imagine. Hypocrisy enough?",:** Crushed somewhere between line 3 and 4 of your 57th application this week.,4,1.0,1.0,2.0,1.0
10 Totally Legit Reasons Why Getting a Job in 2025 Is the EASIEST Thing Ever.,"**#3 There are only 400,000 other applicants**  
That's right, you vs the population of a small country.  But don't worry, your Canva resume with the soft beige gradient will definitely stand out. **  
LinkedIn, indeed, glassdoor, and now tiktok resumes.  It's like Pokemon GO for employment.  You walk around aimlessly and occasionally scream when something actually appears.",4,1.0,1.0,4.0,1.0
The best advice on how to get a job in this market,"Interview advice: be honest but not too honest**  
When I was interviewing for a job I wanted they asked me a common interview question about a time I failed.   So I told them a real story about how I messed up getting requirements and caused a delay in the release.   I didn't get this job.   The next job I applied to asked the same question, so I told the same story but rephrased it where product threw a bunch of requirements at me last minute and I had to work overtime to get things across the finish line.   I did get this job.",4,1.0,1.0,1.0,1.0
Stop treating interviews like dating. This isn't a social club. It's someone's livelihood.,"Edit: 

So nearly every person that's commenting, this is commenting on the fact that I sound entitled, and I sound like I'm an awful person to work with.  I was not the angle, I was trying to go.  The truth is, I'm exhausted.  I'm exhausted from trying to play the game and somehow never play It right.  Exhausted from overanalyzing every interview after I've had it and really am picking apart 1 or 2 things.",4,5.0,1.0,1.0,1.0
Stop treating interviews like dating. This isn't a social club. It's someone's livelihood.,""" I'm tired of being number two through five because guess what?  It's either the winner or loose out on everything.  

Why would you pick number two if number one had so many more qualifications you didn't even think you need, so now the job expands, and then you still lose.  Now you're not even qualified anymore. 

I am burned out from going through this process over and over and over again and never seeing any results other than a rejection because someone else was better.",4,1.0,1.0,4.0,1.0
I got hired,"I made over a dozen different resumes.  I paid to have my original look more professional, that didn't help so I put it through chatgpt multiple times and literally asked it to ""make me a kick ass resume that'll get me hired""

The sites I was using was, builtin, LinkedIn and indeed.  I got the job through indeed. 

I have no experience in the job and told them I'd learn anything they want to pack me.  He said they will and train me in everything.",4,1.0,1.0,1.0,1.0
How much harder is it for ppl to get a ft job in tech without interning in that company first,"Im from CDE.  

Had 4 internships, 2 in engineering and 2 in tech.  

Didnt like any of the companies, so I didnt get any return offers and neither did i want any from them.  But Im going to graduate soon and do not have anymore time to do more internships.  

If I want to work a tech role in a MNC, or at least eventually so, how much do i lose out against people that have done internships in those MNCs.",4,1.0,3.0,2.0,1.0
[Rant] Rejected in 15 minutes by CEO after 4 rounds and days of work,"No feedback.  No explanation.  Just gone. 

No idea what went wrong.  After the interview, I was sitting on my chair, totally numb and thinking that I just spent 20+ hours building a working AI tool for you and in just 15 minutes got a sweet rejection.",4,3.0,1.0,2.0,1.0
This job market is destroying my sense of self worth.,"Do I just forget my degree and go work as a waiter?  Surely there are jobs out there but clearly no company wants to take me.  I tend to think of myself as a capable and intelligent person with a good work ethic, but trying to find a job and watching my savings dwindle away has made me feel like I am worth nothing. 

I don't really know why I'm posting this.  I guess to vent.",4,5.0,5.0,1.0,1.0
Is tech job market really cooked ?,"I am SWE with 8 YOE.  Nothing too niche, full stack developer that knows a few web dev tech stacks with most recent titles of senior and tech lead.  No AI or ML.  I was laid off in June.  Prepared hard, polished my resume with AI many times, applied to between 200-300 jobs in the span of 2 months.",4,1.0,1.0,1.0,1.0
Emailed HR after a rejection. They rescinded it and gave me an interview with the hiring manager.,"üôèüèº

I'm honestly unsure if I'm at a disadvantage after being rejected by HR.  I suppose this means they sent more qualified candidates to the hiring managers as well and my resume would have been left behind if I weren't an internal candidate?  I am very passionate and knowledgeable about the product we make so I am hoping that will make up for my less relevant resume.",4,3.0,1.0,1.0,1.0
"Does this sound like I got an offer or just a ""check this out""!?","I 26F did an interview for a program assistant, and I think it went very well, however I got this email and at first I was excited as I felt like it was an offer- however re reading it, it sounds like they want me to apply to this position and go through the interview process again- how would you take this? 

The attached job description was an internal document, as it wasn't posted anywhere and definitely something that I would love to do as Im comfortable with the description and job duties. 

So how would you take this email?",4,1.0,1.0,1.0,1.0
I'm washed,"I quit drinking at that time and interviewed for a few jobs. 

After two final rounds for a couple jobs and not getting it both times, i've basically been frozen.  I can't do the interviews, i can barely even bring myself to apply anymore.  I thought it would be easier being sober but it's like my subconscious is trying to sabotage me because of how truly awful it was in those final months of employment.  Here i am, 2 years later, and i'm not even sure if it's possible for me to get a job anymore when i've got a two year gap.",4,4.0,1.0,1.0,1.0
Should I cancel my final rounds with Meta?,"If doing interviews, I think it's just for the sake of gaining experience.  I don't want to waste everybody's time.  The thing is I failed the final rounds with Meta in 2024, so if I fail this time it would be the 2nd fail attempt.  But pulling before the final rounds might be better since I technically only failed once I guess.  What do you think?",4,3.0,1.0,1.0,1.0
"51 year old ""Smart Kid"", wasted my life just barely cruising by. What would YOU do now to make something of yourself?","¬†



No savings of any kind, no investments, no 401k's, nothing.  No friends or family, I pretty much live in complete isolation. ¬†



What now?  Who is going to hire a 51 year old when they could hire someone literally half my age to do the same job?  Especially in this job market?",4,4.0,1.0,4.0,1.0
Graduated in August 2024 still no job,"I really wanted to do biotech, and my minor was bioinformatics.  I did really well in college, deans list, projects, one internship.  What else could I possible do?  

I'm underemployed and working a minimum wage job.  I live paycheck to paycheck.",4,1.0,5.0,1.0,1.0
CCDS Policies will NOT help your job search,"Those taking CCDS courses know that they are trying very hard to mandate lecture & tutorial attendance. 

I think objectively this is a terrible policy especially for the current tech sector. 

 

As we know the meta now for hunting for good jobs are mostly internship spamming.  How will attending CCDS outdated lectures help us in this? 

With them trying so hard to force it, how are students going to grind technical interviews ?",4,1.0,5.0,1.0,1.0
