title,selftext,Assignee,feas_pa,feas_ka,feas_cr,feas_sr
How do people apply to hundreds of jobs?,"I'm in Canada, there's not too many internships, definitely not hundreds.  I found a GitHub repo that shows the latest ones posted, I only try to apply to the ones posted within 7 days, but if those only some are in Toronto, where I live. 

Additionally, each application usually requires me to make an account, and then write a cover letter.  This plus the application takes at least 25 mins per application. 

How are you applying to hundreds?",4,1.0,1.0,1.0,1.0
Escaping the 'multiple 1 YOE' trap?,"I've been working at a fintech company for almost 5 years, joined originally as QA but ended up doing a lot of automation/pipeline building/harnessing to automate testing, and then swapped internally to a typical SWE.  

Formally, I am now a SWE 2 with 3 YOE as SWE, but in terms of code complexity I've never really been tasked with complex implementations, only very simple stuff (simple customer bugs/CICD stuff), and it's been affecting my performance reviews, as my development skills have clearly atrophied.  I've never gotten a formal onboarding into my SWE role and it's been rough trying to understand the codebase (product is older than me).  I have been exploring an out (low pay here so I want to leave), but my resume is not getting hits and I am assuming it's because my bullet points aren't exactly ""wow, we should hire this guy,"" due to the nature of my career development here.  I've changed the title of the first job to SDET instead of QA since that was the nature of my job.",4,3.0,1.0,1.0,1.0
New Grad Preparation Advice Needed,"Along with that, objectively the mentorship value is very poor there and I feel like I will have no room to grow. 

The past few months I've been applying and interviewing like crazy and managed to get a summer internship which starts in June at a local company near my school. 

Looking through subs and other sources online, it seems like other juniors are using terminologies (L3, L4, FAANG-specific jargon) that I am not familiar with and it's leading me to believe that I have been left behind and may have little to no chance at getting another offer somewhere else. ).  Having a serious career as a software engineer is something I really dream about and strive for, and I would love if some people could provide some guidance on how to spend my next few months and also some enlightenment.",4,4.0,1.0,3.0,1.0
Please tell me it is ok to renege my offer.,"New grad, first time looking for full time job.  Recently accepted an offer, but later another job came up with way better career opportunities.  I'm thinking about reneging the offer that I already accepted.  However it feels so wrong, and the people I've talked to have been really nice to me.  I cannot risk having no job, so I accepted the first offer fully prepared to renege it.",4,1.0,1.0,1.0,1.0
"Burned out in senior DevSecOps, I enjoy customers more than engineering. How do I switch?","Companies want someone who has worked with paying customers and understands the commercial side. 

I'm trying to figure out how to bridge that gap. 

Has anyone here moved from a senior engineering or DevOps role into TAM, Customer Success, or a customer facing technical role? 

What helped you make the switch?   

What skills or experience did you highlight or build first?",4,3.0,1.0,1.0,1.0
"CS graduate, AWS + K8s certified, multiple final rounds, still no offer. What am I doing wrong?","But got

- Ghosted after technical assessments. 
- Ghosted after final rounds. 
- Rejected with generic emails. 

Fresh out of university, I only had one unpaid frontend internship.  I realized that probably wasn't enough.",4,4.0,4.0,1.0,1.0
I feel like a generalist with no depth. How do I move up to Senior Backend?,"Hi everyone,

I am currently a CS graduate student with about 3 years of work experience as an SDET. 

**My Background:** In my previous job, I had to do a bit of everything: full-stack dev, game engines, automation scripts, DevOps, and cloud/AI infrastructure ... 

**My Current Situation:** I am targeting **Backend roles** (Traditional or AI).  I've built several toy projects using SQL/NoSQL Redis, Kafka, AWS, and K8s to learn the stack, but honestly, it feels useless.  AI tools generate the code and config so easily that I don't feel like I'm actually mastering the technology, and these standard projects don't seem to help me stand out in interviews.",4,4.0,4.0,4.0,1.0
CS New Grad Career Pivot From SWE to Data Analyst,"And then others could find them on this site and message them and arrange a meet.  I thought this would be a cool idea and I could show recruiters or whoever.  

Since I had no experience building anything at that scale with Auth, Email Verification, Rate limiting I used Claude Code to help me design it.  Obviously I'm not a vibe coding monkey since I have the theoretical and programmer brain from my CS degree but I still had no idea what I was actually coding.  I could see a chunks of code and understand it how it does a specific function but going line by line I didn't know what it actually did.",4,3.0,3.0,1.0,1.0
Holy **** this job market is bad - my personal experience with a walk in hiring event,"At this point, im starting to feel like there is something off - three positions were posted in the last few days but the recruiter (who is the head of HR at this hospital) has no idea the jobs even exist.  With a confused look, she searches for the job and comes up empty handed. "" She states she is puzzled and has no idea why they are not showing up.  Then she comes up with an idea, she logs into the internal system with her credentials and the entire situation becomes clear: The three jobs I applied for have already been filled, with internal candidates.  Shocked by this news, she apologizes and admits she knew nothing about it.",4,1.0,1.0,1.0,1.0
PSA: Your applications are literally going nowhere. No one is reading them.,"It's also crazy how I can send an email to ""Greg the Electrician"" who's the CEO, Founder, CTO, CFO, Sole individual contributor, salesperson, lead generator, driver, and supplier of their own business and get a call back within a half hour about doing business, but companies with hundreds of talent acquisition managers, headhunters, recruiters, scouts, etc.  can't even send an email back to say I've been rejected after 4 months of nothing.  ¬Ø\\\_(„ÉÑ)\_/¬Ø

So to recap: it seems like if you don't know the hiring manager (or even if you do in plenty of my own cases) your resume goes nowhere, neither does the portfolio. 2% portfolio review rate from sent applications is honestly just sad.",4,1.0,1.0,1.0,1.0
6 Months of unemployment... Here's my experience,"Basically, all this to say...  The job market sucks.  I was told by my new employer that I interview excellently and have a perfect experience for what they're looking for.  I think there's too many people applying for too few jobs.  If you're in the UK, hold out hope, it will happen.",4,1.0,1.0,2.0,1.0
Ranking Bay Area companies by my recent interview experience,"* The person conducting the second phone screen showed up 5 minutes late and declared 20 minutes before the interview's end that they had a hard stop in 5 minutes. 
* This same person, when I asked how performance is measured at the company, got visibly uncomfortable and told me that's a question for HR.  Their responses to other questions were equally enlightening. 
* Got an automated rejection email the very next day. 

This was my most bizarre interview experience since the last time I interviewed at Google a few years back, and had the interviewer start the conversation with shitting on previous candidates and expressing hope that I can do better.",4,1.0,1.0,1.0,1.0
I am unable to get a job even after doing many final round interviews. What to do?,"So long story short, I have been getting 10-15 interviews every 1-2 weeks.  It is a lot and I attend as many as I can. 

These interviews are either phone calls or in person interviews and if I do have a phone call I usually have an in person interview the next day. 

Everything goes well in the interviews, I know how to properly state my experience and make it seem valid.  I have 4 years as an Operations Assistant for a startup community where it was part-time comission pay (i sometimes worked 30 hours per week with no pay 99% of the time)

So im looking for something that pays as these bills can't wait.",4,1.0,1.0,1.0,1.0
"Got an interview with Wells Fargo, only to say they're not ""hiring"" at the moment","So I've been job searching for a few months now and been getting a number of alerts for Teller jobs at Wells Fargo (I worked for an international bank for 10yrs, resigned about a year ago for personal reasons). ""

The thing is, they would constantly post more and new job ads in Indeed, Linked and other platforms for ""vacancies"" for the same Teller job, which I find pretty misleading.",4,1.0,1.0,1.0,1.0
Feels like Job stability is a myth in 2026,"I mean, not after so much hard work at least.  I reached out to my friends for referrals, but they do not have anything as of now.  I understood the battle is mine to fight.  And I am all alone in this.  I can not explain how BAD it feels sometimes to be in this situation.",4,1.0,1.0,4.0,1.0
My SpaceX Interview Experience,"I asked if we could leverage the fact that I had already had several interviews with positive feedback and my recruiter said yes.  He also said that the team lead that I would be interviewing for really liked my resume and would be willing to have an abbreviated interview process.  I did the initial phone screen and I was told that it went well and another onsite was scheduled.  I was told I would need to do 2 more one-on-ones as well as a written test. 

I went onsite and I thought it went well.",4,1.0,1.0,1.0,1.0
"Second Round Interview (Won't Disclose Salary Because it is ""Internal"" to the structure of the business)",What do you even do?  My concern is that they will low ball you a salary scope and bet on the fact you're invested this far.,4,1.0,1.0,1.0,1.0
"International LLM grad (Trinity), cleared FE1s – struggling to secure legal role. What should I do?","I'm an international graduate who completed an LLM at Trinity (2:1) and have cleared all 8 FE1 exams.  I've been applying for trainee roles, internships, and paralegal/legal assistant positions since August. 

Recruiters have told me that because I've already cleared all FE1s, some firms are hesitant to hire me for junior admin/legal assistant roles as they assume I'll leave once I get a training contract.  On the other hand, I haven't secured a training contract or internship yet either. 

As an international candidate, I can't afford to wait until the next TC cycle.",4,1.0,3.0,1.0,1.0
Should I lie on my resume/application?,"My applications are getting auto rejected.  I reach out to the hiring managers and they don't even want to interview me or give me any consideration at all. 

I'm tired of sending out countless applications for no reason.  Should I start lying and saying I have a year of experience to see if that betters my chances?  I know it seems kinda foolish in a way but I don't know what else to do at this point.",4,1.0,1.0,2.0,1.0
Getting Rejected due to my disability (Help),"&#x200B;

I am currently seeking new opportunities in Operations, Financial Services, or Back-Office Management. 

I bring  6+ years of experience in financial operations, reconciliation, MIS reporting, GST compliance, mutual fund operations (BSE Star MF), and client servicing.  I am presently working as an Assistant Manager – Operations Head, leading workflow efficiency, payment processing, and team operations. 

As a Visually Impaired Candidate, I have consistently proven my ability to perform with accuracy, dedication, and leadership.  However, I have faced rejections due to my disability rather than my capability.",4,4.0,1.0,1.0,1.0
My Recent Interview Experiences in 2026 Hiring Market,Cool.  But I'm still stuck on that question.  Why ask if I have kids?  Was that relevant to the role?  Was he trying to gauge availability?,4,1.0,1.0,1.0,1.0
My Recent Interview Experiences in 2026 Hiring Market,"And yet, they get to make us feel small. 

* If companies only want to hire internally, why post the job? 
* If you've already decided you don't want to hire someone for whatever reason, gender, vibe, whatever, why schedule the interview? 
* If you're going to go with a referral anyway, why put candidates through an emotional rollercoaster? 

You have no idea what goes through someone's mind before, during, and after an interview.",4,1.0,1.0,1.0,1.0
Companies don't want you to leave but they don't want to train you or support your professional growth. Just straight up reinventing the caste system,"No less, because they don't want to invest in training you for even one second.  No more, because they don't want to risk you ""leaving as soon as something better comes along üôÑ"".  

You know how many interviews I had turn sour after I asked about growth opportunities?  Things were going wonderfully, great conversation, fantastic rapport, they go on and on about how impressive my ambition and internal motivation is.  Then I ask about how I can grow with the company and I swear the mood shift is as if I just shit on the floor.",4,1.0,1.0,1.0,1.0
Nightmare interview with finance bros,"And anyone who can't afford be kind or at least polite to interviewees are living miserable lives.  

Anyways, I believe we're stronger than the ones who dare to disrespect us!  I wish the best to everyone on this sub going through the trenches of interviews.",4,1.0,1.0,1.0,1.0
Post final interview anxiety,"I've been interviewing for a job - 3 rounds the last round was in person 2 1-hour interviews with 12 staff in the first one and 14 staff in the second.  I was told they are hiring for two of the same position and it's a brand new team, no internal candidates.  I felt every interview went well, after the final interview I asked what the next steps were and timeline and they said 1-2 weeks and then right when I was being walked out they said hopefully early next week.  Send a thank you email to the hiring managers the next day as my interview ended at 5 pm and within 3 minutes they responded very positively and ended the email saying they hope to be in touch soon.  I can't imagine based on the role and the difficulty that scheduling the final interview with at least 26 people from across sites in person that they interviewed more than 2-3 people.",4,1.0,1.0,1.0,1.0
SWE Internship Decision: Nordstrom (Seattle) vs Oracle (Location TBD),"I received this offer about 2 weeks before my final Oracle round and was given 3 days to accept, so I accepted at the time to avoid losing the opportunity. 

**Oracle (Location TBD)**  
Role: SWE Intern (Full-Stack – AI / Data Platform)  
Pay: $46/hr (\~$1,840/week)  
RTO Policy: Unknown

Dates were not listed in the official offer letter, but in a prescreen email from \~2 months ago, I was told internship start dates could be:

‚Ä¢ May 18 – August 7, 2026  
**OR**  
‚Ä¢ June 15 – September 4, 2026

Originally interviewed for a Java SWE Intern role (Oracle Health & Analytics), but after interviews, was informed that the team was hiring FT only.  I was then moved to a different org working on an AI-focused data platform with a new hiring manager, which is the team this offer was extended from. 

Additionally, the offer letter does not list a confirmed location.  I was told by my recruiter I could choose between several California offices or Seattle — I selected Seattle, but have not yet received written confirmation despite following up with both the recruiter and the hiring manager.",4,1.0,1.0,1.0,1.0
Going on second try,"Hi guys!  I saw my dream internship role from my dream company posted on their career website.  My first application lasted to HR interview.  The HR told me that I was late and the position has been fulfilled, but if I wanted to give it a try, they would put me in their database, not sure which database tho üôà The interview went great, I answered everything clearly and the HR impressed with my experience. 

Now I am going to give my second shot but I am not sure the proper approach to reach the HR, because I wanted to let them know that I have applied again.",4,1.0,1.0,1.0,1.0
That moment when ‚Äòhigh-paying tech job' turns into a full-time unpaid test marathon,"So a recruiter called me about this ‚Äòdream role' at a top tech company—salary sounded amazing.  I was pumped. 

Fast forward:

* 3 unpaid assessment tests
* 2 personality interviews
* 1 coding task that had nothing to do with the actual job

And then… ghosted. '

Why do recruiters hype up these jobs like they're ready to go when the process basically feels like an unpaid internship?  Screening is one thing, but this felt like a full-time job just to prove I exist.",4,1.0,1.0,1.0,1.0
Summer 2026 internship search results,"Ended up getting nervous and blanking on a few questions that in hindsight, I actually knew how to answer haiz ü§°ü§°.  Not expecting to hear back from them at this pt, so I decided to accept my second choice. 

Ig one takeaway for me is how much timing and energy matter.  It's not just about preparation, it's also whether you're actually in a good state (mentally/physically) to perform...  I'd probably pace my interview time slots better and manage my energy more intentionally.",4,1.0,1.0,1.0,1.0
"Had an interviewer cut me off because I was ""not qualified"" ‚òπÔ∏è","Then, every question I was asked proceeding was ALL involving the company's AI, and how I would resolve a situation using their program.  Keep in mind, the description was highly focused on accounting, and not so much on AI. 

I felt like I was not given sufficient information about the roles involvement, as well as the capability of their AI. 

I was cut off not even halfway through the interview, and told I was ""not experienced"" and that I would drown in the position. 


I feel terrible, especially since this was the only response out of over 140+ applications.",4,3.0,1.0,2.0,1.0
"CEO said ""end of week"" for hiring decision - it's 2pm Friday and nothing. Am I cooked?","I'm currently in construction trying to branch into white collar work.  It's been a tough transition so whenever I get an opportunity I put absolutely everything into it.  Here's what I prepared:

\- Built a custom web app from scratch showing the customer's ROI

\- Designed a branded one page product sheet

\- Put together a presentation deck

\- Learned everything about the product inside out

CEO gave me 3 thumbs up, said he could tell I spent a lot of time preparing, gave specific constructive feedback, and mentioned my approach aligns with what their company is already working toward internally. 

Entry level role, no experience required. 

Sent thank you notes after, no response to those either.",4,1.0,1.0,1.0,1.0
Empathy,"What's been harder to deal with is something else entirely. 

Two of my worst interview experiences weren't because the questions were hard.  They were because of the behavior of the interviewers. "" This is a well-established company, not a scrappy five-person operation.  Setting that tone in the first few minutes felt less like transparency and more like a warning.",4,1.0,1.0,1.0,3.0
How would you read this situation? Rejected? Still Hope?,"I understand that one week after a panel interview is not necessarily a red flag.  But what's making this difficult is that throughout the process, there was steady momentum.  I was kept informed at every step.  There was consistent communication and clear forward movement each week.  Now, suddenly, it feels vague and quiet after the final round.",4,1.0,1.0,1.0,1.0
Pre-Offer Question,"Today (Feb 27) she just said that they will be in touch early next week.  All her emails were said in a positive tone and don't indicate a shift in interest, to me at least.  

  
Do you think they are waiting because they are considering other candidates or that they intend on sending an offer and need this time to draft contract, align internally, etc?",4,1.0,1.0,1.0,1.0
"Brave Software director screening went south fast, these companies are weird","The issue was not technical depth.  Deep systems knowledge is valuable.  The issue was alignment.  If the role is effectively ""senior systems engineer"" that should be explicit.  When a position is labeled Release Engineer, most candidates will prepare to discuss build graphs, caching strategies, deterministic builds, artifact promotion models, and release safety mechanisms.",4,1.0,1.0,1.0,1.0
Rejected by my former internship boss after interviewing with her,"Or so I thought.  

  
I was rejected via an email that was sent to my spam folder a full month later, today.  I'm so fucking lost I have no idea what to do.  

I have good experience.  Prior to today, I THOUGHT I had good references.",4,1.0,1.0,2.0,1.0
Looking for advice,"Hey guys I graduated last June with a computer science BA degree but I was pretty depressed/directionless/unmotivated/lazy throughout college so I never got an internship or really tried looking for a job.  My mental state is finally better after intense therapy but I am unsure where to start from here as I see everything is really cooked?  Is it this bad, do I need to look for another career?  I keep on seeing job market is cooked but what exactly is the alternative then?  Right now I work a tutoring job but I don't think education field is my thing.",4,3.0,4.0,3.0,1.0
Are neurodivergent candidates with other conditions like me just screwed in this job market?,"Right now, I'm working at a part-time data entry job for 25 hours a work that's literally just entering in records from death records of scanned PDFs that get sent to the office and only required a high school diploma.  It's the easiest job I've ever done and that's not bad given my current state and it's better than nothing.  However, I've only got 1000 hours I can work until my apprenticeship position is up and even then it's not guaranteed I'll get a full-time job afterwards.  I'm grateful that vocational rehabilitation sent me the PDF of the job listing (it wasn't public) and that I got it, but I'm literally in there doing the exact same thing as many of the full-time data entry coworkers but without being full-time or getting whatever benefits they have too.  I'm on Medicaid and my renewal got accepted and that's good, but I now have until August (that's when my 1000 hours will be up) before I need to start looking again.",4,1.0,1.0,3.0,1.0
Interviewer didn't showed up,"I basically spent 45 minutes of my life waiting for a ghost in a machine. 

Is this the new meta for ""efficient hiring""?  Sending out broken automated invites and seeing who is desperate enough to wait nearly an hour in a virtual lobby? 

I sent a follow-up pointing out the blank fields and the 40-minute wait, but honestly, at this point, is it even worth a reschedule?",4,1.0,1.0,1.0,1.0
Should I move to a city that would force me to commute an hour to my current role while I keep apply? or should I stay for another year where I am?,"I have been applying in hopes to secure a job prior to the move.  I have gotten interviews with no job offer, but it has been difficult to interview with a full-time job. 

My motivations fall more in line with security, but I don't want to be too comfortable in a position that may not serve me any purpose in the long term.  Additionally, in the major city I would be closer to my friends, family, and more spaces for my hobbies. 

Now here is the dilemma.",4,1.0,1.0,1.0,1.0
"Career Advice, what should i do?","So here's my situation.  I'm currently unemployed, and my savings will probably only last about two to three months.  Because of that, every job offer feels important, and turning one down feels risky, even when something about it doesn't sit right. 

I recently got an offer for a Legal Specialist role at one of the largest Chinese owned nickel manufacturing companies in Indonesia.  At first it sounded okay, but as the hiring process went on, a lot of red flags started showing up.",4,1.0,1.0,1.0,3.0
If I'm struggling to get an internship… how will I ever manage to get a job?,"That's the question I keep asking myself lately.  I've been searching everywhere, career sites, LinkedIn, networking groups, and even experimenting with AI tools like Adzuna, Jooble, Humaboam, and Authentic Jobs, but the silence after applications feels discouraging. 

It makes me wonder if internships are already this hard to secure, what happens when it's time to chase actual jobs? 

I'm trying to stay consistent with applications and keep refining my approach, but the doubt creeps in.  Maybe it's not just about sending more resumes, but about figuring out how to stand out in the process.",4,4.0,4.0,1.0,1.0
How to balance two internships offers (Quant),"I received two quant internship offers from both firm A and firm B for the Nov' period.  I have a relatively strong preference for Firm A (somewhat more prestigious + other things) so I picked that for Nov '26.  However, there are many factors that are unknown, and it is very possible if I work at both I will find firm B as better. 

Firm B came back to me and is offering to intern me in the June '26 period.  I'm unsure if I should take it.",4,1.0,1.0,1.0,1.0
"Got fired yesterday, third interview tomorrow","I live in Western Europe. 

Edit: I wont talk about it.  Will let know how it went!  Thanks for the help everyone. 


Update: interview went well :) They asked when I could start.",5,1.0,1.0,1.0,1.0
