title,selftext,Assignee,feas_pa,feas_ka,feas_cr,feas_sr
Trying to switch roles as an ML engineer and nothing makes sense anymore,"Uber — got an MLE interview, was asked some Fisher–Yates shuffle variant + time complexity derivation + probability + some experimentation stuff in a single question.  I didn't get the optimal solution, only a suboptimal one.  Felt kinda shaky.  Recruiter still told me I cleared the screen, had positive feedback and scheduled the loop. "" Like what?",Overlap,4.0,1.0,1.0,1.0
Trying to switch roles as an ML engineer and nothing makes sense anymore,"In the tech screen interview, I get asked to improve performance of a classifier on an imbalanced dataset and actually code it. 

Now this one is partially on me — I haven't really done hands-on classical ML in like 2+ years since I've been focused on infra.  I talked about adjusting class weights and trying different loss functions, but I blanked on classifier threshold tuning in the moment.  I had studied ML theory pretty deeply (derivations, intuitions, all that), but just didn't recall that threshold tuning knob under pressure.  Got rejected.",Overlap,4.0,1.0,1.0,1.0
Trying to switch roles as an ML engineer and nothing makes sense anymore,"I've solved like 350–400 Leetcode problems.  I have good ML infra experience.  I've worked on pretty complex systems for my level of experience.  I've done ML research.  But every interview feels like a completely different role:

‚Ä¢	One wants hardcore DSA

‚Ä¢	One wants deep ML theory

‚Ä¢	One wants LLM/agents

‚Ä¢	One ends up being SQL dashboards

‚Ä¢	One throws random OS problems

There's no consistency at all.",Overlap,1.0,4.0,1.0,1.0
Backend vs AI/ML for High Paying Jobs in India (Fresher Confused,"What should I do now?  Should I also start learning AI stuff?  Or learn System Design, Distributed Systems, and DevOps. 

I do really like Backend.  But I definitely want to have food on my plate.",Overlap,2.0,3.0,1.0,1.0
Tell me the one time a recruiter actually got you the job.,"Anyways, haven't had another success since.",Overlap,1.0,1.0,1.0,1.0
Do you Think Internships are ruining the Entry Level Job Market?,"This is how we got to the point where ""entry level"" means 2+ years of experience when it should really be 0. 

Now, I'm not really sure what the solution for this is besides companies lowering their standards for experience, but it was just a thought I had the other day I waned to share.  Let me know what you think!",Overlap,3.0,3.0,1.0,1.0
"CEO said ""end of week"" for hiring decision - it's 2pm Friday and nothing. Am I cooked?",Is end of week passing without contact a bad sign?  Has anyone been in this situation and still gotten the job?,Overlap,1.0,1.0,2.0,1.0
Just need to vent,Rant over.  Just know that I'm sick of this shitty ass job market and employers bullshit.,Overlap,1.0,1.0,4.0,1.0
Empathy,"It's hard to perform at your best when the person evaluating you appears disengaged from the conversation. 

I understand the market is tough.  I understand companies have leverage right now.  But basic professionalism and empathy should not disappear just because the hiring landscape favors employers.  Candidates are human beings navigating layoffs, uncertainty, and intense competition.",Overlap,3.0,1.0,1.0,1.0
How would you read this situation? Rejected? Still Hope?,"I'm struggling to interpret that shift.  Is this a sign they may be extending an offer to someone else and waiting for it to be signed before rejecting other candidates?  Or am I overanalyzing a normal internal decision window, and it could still be me? 



I have anxiety, and I'm aware that plays a role in how I'm reading this.  I haven't stopped applying elsewhere.",Overlap,1.0,1.0,5.0,1.0
How are recent grads supposed to break into their industries if there are no entry-level roles anymore?,"I have very strong technical skills from freelancing and am hungry and ready to hit the ground running, but that doesn't seem to matter. 

Anybody else in the same boat of not being able to break into their career field after graduating?",Overlap,1.0,2.0,2.0,1.0
Vent: Recruiter told me I wasted his time and hung up because I needed time to prepare.,"Also, I am looking to come back to Amazon.  so, I said, Ill take a month to prepare, and if something happens with Amazon, I will let him know. 

So, he says ""If you are not 100% sold on the company, then I dont want to proceed.  You should have told me you are looking at Amazon.  You wasted my time"" And he hung up.",Overlap,1.0,1.0,1.0,1.0
Read some tea leaves,"Lot of fun

Just now recruiter emails…just to say they will have an update Monday-Tuesday.  

What will that be?",Overlap,1.0,1.0,1.0,1.0
Rejected by my former internship boss after interviewing with her,"I know so many people have it worse than me, especially these days, and the fact that I am able to make money on the side is a huge bonus, but I'm so sad and lost.  I feel so bad all the time.  My friends, employed, in school or otherwise all get it like crazy and clearly care about me, but I'm drinking more and more, and I have no idea what the future even looks like anymore, let alone how to get there.  

If you have advice, I'm all ears.  If you're on this sub, I doubt your fortunes are much better.",Overlap,5.0,1.0,1.0,1.0
Are neurodivergent candidates with other conditions like me just screwed in this job market?,"No time to practice at all since it's assumed they have those skills. ""

**Edit 2a:** I almost forgot one of the biggest parts, which is that I'm applying to Clinical Research positions in this case even though they're Bachelor's level at most because most of the jobs that demand a Master's or PhD require public speaking and other executive functioning demands that would be too demanding for me.  I'm going to discuss more about my disabilities in the next paragraph but I was able to do research assistant duties like literature reviews and whatnot just fine.  It was just the other demands like public speaking, teaching, etc.  that weren't compatible with me at all.",Overlap,5.0,1.0,5.0,1.0
Your resume template matters way more than I thought,"I honestly underestimated how much resume formatting actually matters.  I always thought content was everything and the template was just a design choice. 

The past few weeks I went down a rabbit hole reading about ATS checkers and testing different resume formats.  Turns out, some resumes that look great to us get completely messed up by applicant tracking systems.  Others are ""optimized"" but look boring or awkward.",Overlap,1.0,1.0,1.0,1.0
Did I miss my window?,"I graduated May 2025 and I'm still looking for a real entry level software engineering position.  At what point will I have gone too long without legitimate experience?  I realized that with the start of March I've hit 10 months, and I'm basically already competing with a new graduating class who look better on paper because they don't have this gap.  I don't know how long I should give this before I go back to school or something.",Overlap,1.0,1.0,5.0,1.0
Interviewer didn't showed up,"Still sitting there looking at the ""The organizer will let you in when the meeting starts"" screen. 

5:20 PM.  I send a polite ""checking in"" email to the recruiter.  Silence. 

I decided to be ""the bigger person"" and stayed until 5:40 PM just in case there was a massive internal emergency.",Overlap,1.0,1.0,1.0,1.0
"2026 CS Summer Internship Search....redpill, tips and some encouragement","welcome all, cs kids or not.  As I landed an offer for this summer'26 recently i wanted to share some tips on how to navigate through this crowded market with summer offers being the TOUGHEST to land.  I would like to add that this guide is NOT for first rodeos because 3 months stints are tough to find especially without a network. 5 YoE.  Mostly reached out to MNCs and Startups from oct'25, pivoting to SWE.",Overlap,1.0,1.0,4.0,1.0
"2026 CS Summer Internship Search....redpill, tips and some encouragement","4.  Trust and detach yourself from the outcome

I believe that best work is done when you fully detach yourself from the results.  The grind, the amount of work, the preparation — when done — will eventually pay off.  I dont know who needs to hear this but before I got my offer i questioned myself time and time again when i would get my big break and if I would even get one.  I would break down at times because it felt like i was pivoting into a career path that was bigger than myself.",Overlap,3.0,1.0,1.0,1.0
Romanticising being unemployed…,"I don't like working, in any capacity, and I want a new job desperately.  

These past few months we've been told some people are being made redundant, however I now know I'm not.  

I'm not gonna lie c I was kind of daydreaming about just not working for a while.  Yes the money is terrible on the dole, but just to be able to relax and what not

I know this is not the case, but it just seems to be where my mind is going.  Talk me out of it.",Overlap,1.0,1.0,1.0,1.0
Lower education jobs that actually benefit others?,"Hopefully I can find something that I can do and not have to go without meals too often or what bill to sacrifice.  I am not strong nor have a particularly enjoyable personality.  Not to say that I am unkind, I just do not find it easy to make a ""happy tone"" or facial expressions or hold a conversation.  Direct communication is really all that I could say works well with me.  I say that simply to be upfront about my limitations.",Overlap,2.0,1.0,1.0,2.0
"Career Advice, what should i do?","HR and the user department often gave different answers to the same questions, so things were confusing from the start.  During the interview they mentioned overtime pay, but in the offer letter, it was suddenly gone. 

When I read the offer more carefully, it got even weirder.  The basic salary is low, and the rest is split into different variable components like attendance and performance bonuses to make the total look higher.  The result is that benefits, holiday bonuses, and severance are all calculated from that lower base salary.",Overlap,1.0,1.0,1.0,1.0
What is the point of having sophisticated hiring pipelines?,"Are they hiring anyone and everyone for roles they are not fit for?  What the point of having multiple rounds of interviews?  If they are using AI, how are they managing to clear Technical Behavioral Rounds and Scenario based questions?",Overlap,1.0,1.0,3.0,1.0
Should I follow my dream or choose stability?,"I do not have a passion for retail nor do I want to work within retail for my whole professional career.  I would much rather work at a corporate level and do consumer research.  This isn't looking down at all the incredible hard work and effort it takes into running a store, because god do I see you.  However, I took this job because it was offered to me, even if it wasn't what I really wanted to do. 

Here's the thing: A recruiter reached out to me in January at a certain shoe brand, in a role that specializes in customization.",Overlap,1.0,1.0,1.0,1.0
"Had a final round interview, crushed it, then got ghosted for 3 weeks — turns out the position was ""put on hold""","three rounds of interviews, a take-home assesment that took me about four hours to complete, two months of my life, and i get a one-paragraph form email.  the thing that really gets me is that i turned down another interview during this process because i felt like this one was basically done.  no idea if the role will ever come back, no idea what ""on hold"" actually means, and obviously no way to get those four hours back.  i know this is extremely common based on what i read here but it doesnt make it any less demoralizing when it actually happens to you.",Overlap,1.0,1.0,2.0,1.0
Wow interviews suck more now,"During the interview with HR (no recruiter present), i was asked what is my salary expectation.  I repeated the same number recruiter told me.  HR said they had a lower budget.  I said i would be open to negotiating to accommodate their budget .  I don't know if negotiating was the wrong word but she didn't like it.",1,1.0,1.0,2.0,1.0
"The bar is absolutely, insanely high.","I was very confident I got the internship.  I received rejection today and I have no idea what I could've done better besides code faster.  Even at the rate I was working through my solution, I think I was going decently quickly.  I guess there must've been amazing candidates, or they had already made their selection.  There could be a multitude of reasons.",1,4.0,2.0,5.0,1.0
Wow y'all were right... (Referrals),"Fast forward to the call, I did some quick prep on reviewing my resume and the company.  He was a super nice guy, asked me some questions about my resume, what the job entails, and just overall a chill conversation abt who I was and my skills.  i didn't have to do any leetcode style technical interview and I essentially bypassed the whole ""traditional process in a sense"".  So yeah I knew connections were important within the work force and adult life but holy shit this was one of those eye opener moments cause I didn't realize how powerful it could be.",1,2.0,1.0,1.0,3.0
We should normalize HR shaming.,"A few months ago I got a call, during which I was invited for an on-line interview for a position for which I had **not** applied by a very large company's HR.  Of course, I accepted the invitation because, why not.  

So, the time of the interview comes.  

**First red flag:** HR is late by 10 minutes.  

The meeting is then joined by a senior and a junior HR member.",1,1.0,1.0,1.0,1.0
"After 8 hours of interviews, they're offering me less than minimum salaried wage for my state. Where to go from here?","EDIT: I've just learned that this salary would make me eligible for public housing assistance and is either on par with or below the median salary for a fast food worker in my area. "" Yeah I'm gonna have to see a higher number.",1,1.0,1.0,1.0,1.0
THIS is why you don't get any responses from your job applications...,"We might be doomed if we can't find an internal reference somewhere.  Just saying. 

Note: I think you have to subscribe to LinkedIn Premium to see this information.  I'm on a 30-day trial.",1,3.0,2.0,4.0,2.0
I cannot take it anymore,"The other one ghosted me.  Why?  Not because I was bad, or because I failed the interview.  They just wanted someone with more experience on their stack.  

All those interview requests went the fuck away.",1,5.0,4.0,2.0,1.0
"Job Search After 4,000 Applications","It will destroy your mental health much faster than you think.  Place a limit on how much time you'll spend applying each day, and spend the rest of the time doing something productive like working part time/studying, or just doing something fun like playing video games.  Trust me, you won't do well in interviews if you've spent the entire last 7 days applying nonstop. 

Whatever you do, just remember, any application could be the one.  Don't lose hope.",1,1.0,1.0,1.0,1.0
Just Received a Fully Remote Job Offer as a Self Taught SWE - Spreading Some Positivity and Hope,"I have been offered a full-time remote position as a software engineer in an international mid-sized company, with big customer base and highly distributed systems.  The offer I received is realistic and slightly above average for my years of experience and the consideration it's a fully remote position, therefore I have gladly signed it and accepted it. 

The agenda of my post is first and foremost spreading some positivity and hope in this Subreddit in these tough market conditions, because I feel like many people can use it here as a motivation to keep trying.  Secondly, I would like to celebrate this moment here in this Subreddit and post about the good times, the same as I did when I posted about the bad times. 

I wish everyone out there the best of luck in their job hunting journey, and as I said I want to shed some light and spread positivity proving that it is possible to get offers with the right skills, hard work, consistency, and a bit of luck.",1,1.0,1.0,1.0,1.0
"6 months job hunting, apparently my 4+ years don't count because I haven't touched their specific tech stacks","**And another thing** \- why the fuck don't internships count as ""real experience""?  I spent 3 years doing actual work during internships.  Not fetching coffee or making copies - I was troubleshooting servers, implementing security policies, managing infrastructure.  But apparently that's ""just internship experience"" and doesn't count toward their magical 5-year requirement. ""** You know what would solve that?",1,4.0,3.0,2.0,1.0
"Got an interview invite… then got CC'd on the ""he's out"" email. What would you do?","So I recently interviewed with a panel of four people at a county courthouse for an IT developer role.  One guy couldn't make it to the interview.  A week later, I get an email from that same guy asking to schedule a Zoom meeting to get acquainted.  Cool, right? 

Well… not for long.",1,1.0,1.0,1.0,1.0
Nego Pay First Job?,"Just completed CS degree (fch) and received a software dev job offer from a deep tech startup (founded ~10 years ago, last funding round &lt;4 years ago). 

It's my only one so far after months, and I've been communicating directly with the founder throughout.  It is slightly below both the industry median but equal to NTU CS median (GES 2024). 

I was initially happy to accept, but friends said I should negotiate since companies often expect it and start low.  I'm hesitant because I have limited internship experience (just one, though relevant and they were happy with it during the interview), and I don't want to offend or risk getting it rescinded.",1,4.0,2.0,2.0,3.0
Stop treating interviews like dating. This isn't a social club. It's someone's livelihood.,"But I wish they would have given me clear answer as to why I wasn't chosen, because it's hard to improve when they don't tell you what you need to fix.  3 of those times they just closed the job opening, because they realize they can't bring on someone new, which is a new hell in its own way. 

I guess my approach of coming at this with anger was not the best method.  But somehow, someone in the comments, even after I make this edit, will claim that I'm whining or that I'm entitled or something of that nature.  

How is it entitled to feel like everyone deserves to earn a living that everyone deserves to live that everyone deserves to have some to have a house over their head, food in their mouth and a bed to sleep on.",1,1.0,1.0,2.0,2.0
I don't know what to do with my life.,"As far as I know, plumbers never run dry of a job and they get paid relatively well, and I enjoy hands on work.  I'm tired of my family shutting down my ideas and telling me it's ""a man's job"" instead of at least trying to be the slightest bit of supportive.  I already honestly have no will to really do anything, so I'm still just working the same part-time job I've been at for almost 3 years now, but I'm still actively applying for higher waged jobs and looking for trade programs I'm interested in.  All in all, it's just so frustrating just barely passing a month from being graduated and having absolutely no support system or anyone to turn to.",1,4.0,2.0,4.0,1.0
Recruiter asked me to lie about competing offer,"I'm currently in the process of joining a Faang company and I'm at  salary negotiation.  The internal recruiter asked me to lie that I got an offer, and even told me what numbers to give about the offer.  He asked me to send an email with that information.  He said doing this would speed up the negotiation.  What should I do?",1,1.0,1.0,1.0,2.0
[Rant] Rejected in 15 minutes by CEO after 4 rounds and days of work,"Totally frustrated and needed to let this out. 

I am a new grad, Dec 2024, with some years of work experience.  I have been applying like crazy and finally got an interview with a company, and I thought that ""Finally, I might land this job as I cleared 4 rounds"".  But bro, this one totally broke me. 

Here's how it went:

1.",1,1.0,1.0,1.0,2.0
"Alright, this IS the worst job economy we've ever seen in the 21st century, right?","*** **In 2008, the internet was not nearly as prevalent in job hunting.  Now it's set up so you need to not only deal with competition between 100 other applicants for the same role, but also the threat of fake job listings, and the AI BS. **

When I was in high school in the mid-2010s, I could apply to *maybe* 5-10 positions and actually be able to land at least one of them without much issue within a month of searching.  Today, I'm struggling to find anything in my field (or not) after over a YEAR of searching.  I recently applied to Walmart and was rejected a week later.",1,1.0,1.0,5.0,1.0
Is tech job market really cooked ?,"Here are a few things that I believe gave me an edge or worked in my favor:
- referrals from my network
- local jobs that required hybrid schedule
- tailored resumes
- soft skills
- activity on LinkedIn (mostly commenting)

I also tried to outsource the filling out job applications part so I can focus on preparing and interviewing but I didn't have much success with freelancers from Fiverr.  I was also approached by a ""do it for you"" company but they charge % of your first year salary + a fixed fee and I decided to just do it myself.",1,2.0,1.0,3.0,2.0
Escaping Legacy Tech: Landed 2 AI Offers After 8 Months of Prep (250k+ TC),"5 months): Started from almost zero and crammed, studying about 15 systems deeply, mainly through videos and practice. 

Applications: Sent out over a thousand applications with very low callback.  Landed interviews mostly through headhunters.  

Interviews (6 months): Juggled my full-time job while going through processes with 45 companies (failing most of them early on). 

It was brutal: endless rejections, self-doubt, and burnout.",1,2.0,3.0,3.0,1.0
"Job Hunt 2025 has been Abysmal, so i walking a different path, wbu?","Hi everyone,

Final year student here.  Like many of you, I've been spending my nights scrolling through LinkedIn, sending out resumes, going for interviews which mostly ghost or take too long to reply.  The job market feels brutal right now, and honestly, it's been pretty demoralizing. 

Before the brutal reality of the job market, I was juggling my FYP and other group projects felt like drowning in Google Drive folders.  It was a mess.",1,3.0,2.0,4.0,1.0
To accept full time offer or wait it out?,"salary is alright.  

however, starting this early next year would mean that i will have lesser time to interview with other companies and increase my chances of getting a role and industry i want.  additionally, i think its possible to secure a better industry as objectively speaking, i have a decent resume which includes an internship with a FAANG company, and taking this offer just feels slightly wasted for what i have achieved thus far in terms of my internship experiences.  

what do you think?",1,1.0,1.0,1.0,1.0
"After being turned down for $14 jobs, I finally got a good job offer and I can't stop crying.","They called me for an interview for accounts payable.  $10.  I thought that was too low and cancelled.  

4.  They called me for an interviewed that I had no experience with.",1,3.0,1.0,2.0,1.0
Can you resort to just emailing small local businesses for opportunities?,"They just seem to have an unproportionate amount of designers, content managers & seo specialists, and marketing talent compared to the developer teams.  Which, presumably the other stuff may require more hands on deck. 

Anyways, was just seeing the best way to go about this.  I am not sure if they get flooded with other people asking as well (they are all in a medium sized college town after all).",1,3.0,2.0,1.0,1.0
Why aren't people more upset about the bad job market?,"Why do we allow other places to hide behind their computers while AI rejects unread resumes anyway?  Even those who are lucky enough to have jobs are either wishing they had something more sustainable,  or are simply trying to escape a system that would rather keep them unemployed.  

What are people's thoughts about this?  What should be done to take back a broken system?",1,2.0,1.0,5.0,1.0
Do you think I got the job?,"Just finished my second (and final) interview for a software development intern position.  First interview went very well and I feel like the second also went pretty well. 

I feel like the interviewer towards the end of the interview started saying things and asking questions that seemed like they would only ask if they were planning on offering me the position. 

Things like:

\- Describing the on-boarding process

\- Asking what is the earliest date I would be able to start

\- Confirming I am willing to relocate to the office

\- I asked if the had any concerns or doubts about me throughout the application process that I would clear up and they responded with something along the lines of  ""No, I've been impressed with your knowledge and you're a very strong candidate""

\- Saying ""you can expect an email from us soon"" (I guess I that could be good or bad)

Obviously I'm not assuming I got the position and don't want to get my hopes up too much but I'm wondering if companies ever know whether or not they are going to hire someone during an interview.  Do you guys think these are weird things to say/ask if they were unsure about whether they would move forward with me or not?",1,1.0,1.0,1.0,1.0
